<?xml version="1.0" encoding="UTF-8"?>


<OrderList

xmlns="https://hocvietcode.com"
xmlns:xsi="http://www.w3.org/2001/XMLSchema-instance"
xsi:schemaLocation="https://hocvietcode.com order_list.xsd"
>
    <ProductList>
        <Product>
            <Name>Product A</Name>
            <Quantity>2</Quantity>
        </Product>
        <Product>
            <Name>Product B</Name>
            <Quantity>1</Quantity>
        </Product>
    </ProductList>
    <Address>
        <Street>Cau Giay</Street>
        <City>Ha Noi</City>
    </Address>
</OrderList>
